{
  "id": "dark",
  "name": "dark",
  "displayName": "Dark",
  "description": "Default dark theme for QueryStudio",
  "author": "QueryStudio",
  "version": "1.0.0",
  "isDark": true,
  "isBuiltIn": true,
  "colors": {
    "background": "oklch(0.23 0.005 285)",
    "foreground": "oklch(0.93 0 0)",
    "card": "oklch(0.27 0.005 285)",
    "cardForeground": "oklch(0.93 0 0)",
    "popover": "oklch(0.27 0.005 285)",
    "popoverForeground": "oklch(0.93 0 0)",
    "primary": "oklch(0.93 0 0)",
    "primaryForeground": "oklch(0.23 0.005 285)",
    "secondary": "oklch(0.32 0.005 285)",
    "secondaryForeground": "oklch(0.93 0 0)",
    "muted": "oklch(0.32 0.005 285)",
    "mutedForeground": "oklch(0.65 0.01 285)",
    "accent": "oklch(0.32 0.005 285)",
    "accentForeground": "oklch(0.93 0 0)",
    "destructive": "oklch(0.65 0.2 25)",
    "border": "oklch(0.28 0.005 285)",
    "input": "oklch(0.3 0.005 285)",
    "ring": "oklch(0.55 0.01 285)",
    "chart1": "oklch(0.55 0.2 250)",
    "chart2": "oklch(0.65 0.15 170)",
    "chart3": "oklch(0.7 0.15 80)",
    "chart4": "oklch(0.6 0.18 300)",
    "chart5": "oklch(0.65 0.2 30)",
    "sidebar": "oklch(0.2 0.005 285)",
    "sidebarForeground": "oklch(0.93 0 0)",
    "sidebarPrimary": "oklch(0.55 0.2 250)",
    "sidebarPrimaryForeground": "oklch(0.93 0 0)",
    "sidebarAccent": "oklch(0.3 0.005 285)",
    "sidebarAccentForeground": "oklch(0.93 0 0)",
    "sidebarBorder": "oklch(0.28 0.005 285)",
    "sidebarRing": "oklch(0.55 0.01 285)"
  }
}
