{
  "id": "rose-pine",
  "name": "rose-pine",
  "displayName": "Rosé Pine",
  "description": "Rosé Pine theme",
  "author": "QueryStudio",
  "version": "1.0.0",
  "isDark": true,
  "isBuiltIn": true,
  "colors": {
    "background": "#191724",
    "foreground": "#e0def4",
    "card": "#1f1d2e",
    "cardForeground": "#e0def4",
    "popover": "#1f1d2e",
    "popoverForeground": "#e0def4",
    "primary": "#eb6f92",
    "primaryForeground": "#191724",
    "secondary": "#26233a",
    "secondaryForeground": "#e0def4",
    "muted": "#1f1d2e",
    "mutedForeground": "#908caa",
    "accent": "#26233a",
    "accentForeground": "#e0def4",
    "destructive": "#eb6f92",
    "border": "#403d52",
    "input": "#403d52",
    "ring": "#eb6f92",
    "chart1": "#eb6f92",
    "chart2": "#c4a7e7",
    "chart3": "#31748f",
    "chart4": "#f6c177",
    "chart5": "#ebbcba",
    "sidebar": "#191724",
    "sidebarForeground": "#e0def4",
    "sidebarPrimary": "#eb6f92",
    "sidebarPrimaryForeground": "#191724",
    "sidebarAccent": "#26233a",
    "sidebarAccentForeground": "#e0def4",
    "sidebarBorder": "#403d52",
    "sidebarRing": "#eb6f92"
  }
}
