{
  "$schema": "https://assets-cdn.querystudio.dev/theme.schema.json",
  "id": "catppuccin",
  "name": "catppuccin",
  "displayName": "Catppuccin Mocha",
  "description": "Catppuccin Mocha theme",
  "author": "QueryStudio",
  "version": "1.0.0",
  "isDark": true,
  "isBuiltIn": true,
  "colors": {
    "background": "#1e1e2e",
    "foreground": "#cdd6f4",
    "card": "#181825",
    "cardForeground": "#cdd6f4",
    "popover": "#181825",
    "popoverForeground": "#cdd6f4",
    "primary": "#cba6f7",
    "primaryForeground": "#1e1e2e",
    "secondary": "#313244",
    "secondaryForeground": "#cdd6f4",
    "muted": "#181825",
    "mutedForeground": "#a6adc8",
    "accent": "#313244",
    "accentForeground": "#cdd6f4",
    "destructive": "#f38ba8",
    "border": "#313244",
    "input": "#313244",
    "ring": "#cba6f7",
    "chart1": "#cba6f7",
    "chart2": "#89b4fa",
    "chart3": "#a6e3a1",
    "chart4": "#f9e2af",
    "chart5": "#f38ba8",
    "sidebar": "#11111b",
    "sidebarForeground": "#cdd6f4",
    "sidebarPrimary": "#cba6f7",
    "sidebarPrimaryForeground": "#1e1e2e",
    "sidebarAccent": "#181825",
    "sidebarAccentForeground": "#cdd6f4",
    "sidebarBorder": "#313244",
    "sidebarRing": "#cba6f7"
  }
}
